{
  "event": "recording.completed",
  "delivery": "01J8ZCJ9T6K4NQX8VM2TRB7PD5",
  "occurred_at": "2026-08-28T21:44:20.117Z",
  "node": "origin-atl-01",
  "node_role": "origin",
  "contract_version": 1,
  "stream": "show-2041-main",
  "session": "01J8ZC8XKWQ4M7T0K3PZ2B9RVN",
  "epoch": 3,
  "recording_id": "01J8ZCK5M2V8QNX4RW7TKB3PD9",
  "artifact": "ingest",
  "state": "finalized",
  "reason": "api_stop",
  "parts": 1,
  "path": "/var/lib/tmesis/recordings/show-2041-main/01J8ZC8XKWQ4M7T0K3PZ2B9RVN-ingest-0.ts",
  "container": "mpegts",
  "capture_container": "mpegts",
  "bytes": 21493022208,
  "dropped_bytes_total": 41943040,
  "duration_seconds": 9138.6,
  "started_at": "2026-08-28T19:12:01.52Z",
  "ended_at": "2026-08-28T21:44:20.103Z",
  "checksum_sha256": "9f2c1d5e6a7b8c9d0e1f2a3b4c5d6e7f8091a2b3c4d5e6f708192a3b4c5d6e7f",
  "destination": "/mnt/archive/ingest",
  "retention_expires_at": null,
  "labels": {
    "show_id": "2041",
    "site": "csn"
  },
  "source_generations": []
}
